{
  "$schema": "./capabilities.schema.json",
  "schema": 1,
  "release": "1.4.0",
  "expression": "line",
  "assetBase": "/1.4.0/",
  "components": [
    {
      "id": "ody.card",
      "name": "Card",
      "station": "CRD",
      "maturity": "supported",
      "runtime": "css",
      "html": "site/index.html#station-CRD",
      "guide": "site/layout.html",
      "rust": [
        "card"
      ],
      "assets": {
        "css": [
          "odyssey.css",
          "odyssey-line.css",
          "odyssey-expressions.css"
        ],
        "js": []
      },
      "states": [
        "default"
      ],
      "design": {
        "nodeId": "e96p5"
      },
      "tests": [
        {
          "path": "tools/tests/line-browser.test.mjs",
          "coverage": "specimen-smoke"
        }
      ],
      "contract": "library/contracts.json#/components/card",
      "openTodo": []
    },
    {
      "id": "ody.panel",
      "name": "Panel",
      "station": "PNL",
      "maturity": "supported",
      "runtime": "css",
      "html": "site/index.html#station-PNL",
      "guide": "site/layout.html",
      "rust": [],
      "assets": {
        "css": [
          "odyssey.css",
          "odyssey-line.css",
          "odyssey-expressions.css"
        ],
        "js": []
      },
      "states": [
        "default"
      ],
      "design": {
        "nodeId": "J5fzP"
      },
      "tests": [
        {
          "path": "tools/tests/line-browser.test.mjs",
          "coverage": "specimen-smoke"
        }
      ],
      "contract": "library/contracts.json#/components/panel",
      "openTodo": []
    },
    {
      "id": "ody.sheet",
      "name": "Sheet",
      "station": "SHD",
      "maturity": "supported",
      "runtime": "css",
      "html": "site/index.html#station-SHD",
      "guide": "site/layout.html",
      "rust": [],
      "assets": {
        "css": [
          "odyssey.css",
          "odyssey-line.css",
          "odyssey-expressions.css"
        ],
        "js": []
      },
      "states": [
        "default"
      ],
      "design": {
        "nodeId": "CZg7N"
      },
      "tests": [
        {
          "path": "tools/tests/line-browser.test.mjs",
          "coverage": "specimen-smoke"
        }
      ],
      "contract": "library/contracts.json#/components/sheet",
      "openTodo": []
    },
    {
      "id": "ody.section-head",
      "name": "Section head",
      "station": "SHT",
      "maturity": "supported",
      "runtime": "css",
      "html": "site/index.html#station-SHT",
      "guide": "site/layout.html",
      "rust": [],
      "assets": {
        "css": [
          "odyssey.css",
          "odyssey-line.css",
          "odyssey-expressions.css"
        ],
        "js": []
      },
      "states": [
        "default"
      ],
      "design": {
        "nodeId": "QsHp7"
      },
      "tests": [
        {
          "path": "tools/tests/line-browser.test.mjs",
          "coverage": "specimen-smoke"
        }
      ],
      "contract": "library/contracts.json#/components/section-head",
      "openTodo": []
    },
    {
      "id": "ody.tile",
      "name": "Tile",
      "station": "TLE",
      "maturity": "supported",
      "runtime": "css",
      "html": "site/index.html#station-TLE",
      "guide": "site/data-display.html",
      "rust": [],
      "assets": {
        "css": [
          "odyssey.css",
          "odyssey-line.css",
          "odyssey-expressions.css"
        ],
        "js": []
      },
      "states": [
        "default"
      ],
      "design": {
        "nodeId": "MLzN3"
      },
      "tests": [
        {
          "path": "tools/tests/line-browser.test.mjs",
          "coverage": "specimen-smoke"
        }
      ],
      "contract": "library/contracts.json#/components/tile",
      "openTodo": []
    },
    {
      "id": "ody.frame",
      "name": "Frame",
      "station": "FRM",
      "maturity": "supported",
      "runtime": "css",
      "html": "site/index.html#station-FRM",
      "guide": "site/layout.html",
      "rust": [],
      "assets": {
        "css": [
          "odyssey.css",
          "odyssey-line.css",
          "odyssey-expressions.css"
        ],
        "js": []
      },
      "states": [
        "default"
      ],
      "design": {
        "nodeId": "TqGga"
      },
      "tests": [
        {
          "path": "tools/tests/line-browser.test.mjs",
          "coverage": "specimen-smoke"
        }
      ],
      "contract": "library/contracts.json#/components/frame",
      "openTodo": []
    },
    {
      "id": "ody.divider",
      "name": "Divider",
      "station": "DVS",
      "maturity": "supported",
      "runtime": "css",
      "html": "site/index.html#station-DVS",
      "guide": "site/layout.html",
      "rust": [],
      "assets": {
        "css": [
          "odyssey.css",
          "odyssey-line.css",
          "odyssey-expressions.css"
        ],
        "js": []
      },
      "states": [
        "default"
      ],
      "design": {
        "nodeId": "CC8f4"
      },
      "tests": [
        {
          "path": "tools/tests/line-browser.test.mjs",
          "coverage": "specimen-smoke"
        }
      ],
      "contract": "library/contracts.json#/components/divider",
      "openTodo": []
    },
    {
      "id": "ody.well",
      "name": "Wall",
      "station": "WLL",
      "maturity": "supported",
      "runtime": "css",
      "html": "site/index.html#station-WLL",
      "guide": "site/layout.html",
      "rust": [],
      "assets": {
        "css": [
          "odyssey.css",
          "odyssey-line.css",
          "odyssey-expressions.css"
        ],
        "js": []
      },
      "states": [
        "default"
      ],
      "design": {
        "nodeId": "bXNgK"
      },
      "tests": [
        {
          "path": "tools/tests/line-browser.test.mjs",
          "coverage": "specimen-smoke"
        }
      ],
      "contract": "library/contracts.json#/components/well",
      "openTodo": []
    },
    {
      "id": "ody.avatar",
      "name": "Avatar",
      "station": "AVT",
      "maturity": "supported",
      "runtime": "css",
      "html": "site/index.html#station-AVT",
      "guide": "site/studio.html",
      "rust": [],
      "assets": {
        "css": [
          "odyssey.css",
          "odyssey-line.css",
          "odyssey-expressions.css",
          "odyssey-extensions.css"
        ],
        "js": []
      },
      "states": [
        "default"
      ],
      "design": {
        "nodeId": "gwS7d"
      },
      "tests": [
        {
          "path": "tools/tests/line-browser.test.mjs",
          "coverage": "specimen-smoke"
        }
      ],
      "contract": "library/contracts.json#/components/avatar",
      "openTodo": []
    },
    {
      "id": "ody.split-pane",
      "name": "Split pane",
      "station": "SPL",
      "maturity": "supported",
      "runtime": "extensions",
      "html": "site/index.html#station-SPL",
      "guide": "site/studio.html",
      "rust": [],
      "assets": {
        "css": [
          "odyssey.css",
          "odyssey-line.css",
          "odyssey-expressions.css",
          "odyssey-extensions.css"
        ],
        "js": [
          "odyssey.js",
          "odyssey-extensions.js"
        ]
      },
      "states": [
        "default",
        "focus",
        "disabled"
      ],
      "design": {
        "nodeId": "DMGin"
      },
      "tests": [
        {
          "path": "tools/tests/line-browser.test.mjs",
          "coverage": "specimen-smoke"
        },
        {
          "path": "tools/tests/runtime-p1.test.mjs",
          "coverage": "interaction-contract"
        }
      ],
      "contract": "library/contracts.json#/components/split-pane",
      "openTodo": [
        "ACT-07"
      ]
    },
    {
      "id": "ody.button",
      "name": "Button",
      "station": "BTN",
      "maturity": "supported",
      "runtime": "css",
      "html": "site/index.html#station-BTN",
      "guide": "site/actions.html",
      "rust": [
        "button"
      ],
      "assets": {
        "css": [
          "odyssey.css",
          "odyssey-line.css",
          "odyssey-expressions.css"
        ],
        "js": []
      },
      "states": [
        "default"
      ],
      "design": {
        "nodeId": "J3RrTZ"
      },
      "tests": [
        {
          "path": "tools/tests/line-browser.test.mjs",
          "coverage": "specimen-smoke"
        }
      ],
      "contract": "library/contracts.json#/components/button",
      "openTodo": []
    },
    {
      "id": "ody.icon-button",
      "name": "IconButton",
      "station": "IBT",
      "maturity": "supported",
      "runtime": "css",
      "html": "site/index.html#station-IBT",
      "guide": "site/actions.html",
      "rust": [
        "button"
      ],
      "assets": {
        "css": [
          "odyssey.css",
          "odyssey-line.css",
          "odyssey-expressions.css"
        ],
        "js": []
      },
      "states": [
        "default"
      ],
      "design": {
        "nodeId": "PjkgA"
      },
      "tests": [
        {
          "path": "tools/tests/line-browser.test.mjs",
          "coverage": "specimen-smoke"
        }
      ],
      "contract": "library/contracts.json#/components/icon-button",
      "openTodo": []
    },
    {
      "id": "ody.link",
      "name": "Link",
      "station": "LNK",
      "maturity": "supported",
      "runtime": "css",
      "html": "site/index.html#station-LNK",
      "guide": "site/actions.html",
      "rust": [
        "link_with_wire",
        "link_button"
      ],
      "assets": {
        "css": [
          "odyssey.css",
          "odyssey-line.css",
          "odyssey-expressions.css"
        ],
        "js": []
      },
      "states": [
        "default"
      ],
      "design": {
        "nodeId": "ViEaW"
      },
      "tests": [
        {
          "path": "tools/tests/line-browser.test.mjs",
          "coverage": "specimen-smoke"
        }
      ],